Field Name,Description,Example,Notes
library_id,"Unique experiment identifier (e.g., OMX number)",OMX00001,required
library_title,Title or brief name of experiment,Ocular Microbiome RNA-Seq Batch 1,recommended
library_description,Short summary of experiment purpose/design,RNA-seq to profile eye surface samples,recommended
biosample_id,Related sample ID,OMS00001,required
library_name,Name/identifier of the prepared sequencing library,LIB001-A,required
library_strategy,Sequencing strategy (controlled vocabulary),rna-seq,required
library_source,Source material for library,mRNA,recommended
library_selection,Method of nucleic acid selection/enrichment,polyA selection,recommended
library_layout,Read layout (single/paired-end),paired-end,required
library_prep_kit,Kit used to prepare sequencing library,NEBNext Ultra II RNA,recommended
library_prep_kit_lot_number,Lot number of library prep kit,RN2023-02354,recommended
library_prep_protocol_version,Version or code for the library prep protocol,v2.0,recommended
library_prep_date,"Date of library preparation (YYYY-MM-DD, ISO 8601)",2024-05-09,recommended
index_barcode_sequences,"Index/barcodes used for multiplexing, comma-separated","CGATCAGG, ACTGTGTA",recommended
platform,Sequencing platform manufacturer/model (controlled vocab),illumina,required
instrument,Sequencer instrument model (controlled vocab),novaseq,required
sequencing_date,"Date sequencing run performed (YYYY-MM-DD, ISO 8601)",2024-05-12,required
design_description,Additional details or rationale for experiment design,Comparative RNA-Seq of left/right eye samples over 3 timepoints,recommended
